[
  {
    "plik_nazwa": "ala.fastq",
    "status": "Tak",
    "etap": "oryginalne",
    "odczyty_calkowita_liczba": 1000,
    "odczyty_calkowita_liczba_zasad": 10000,
    "odczyty_dlugosc_mediana": 150,
    "odczyty_dlugosc_histogram": [
      {
        "zakres_dlugosci": "10-20",
        "wartosc": 30
      },
      {
        "zakres_dlugosci": "20-30",
        "wartosc": 30
      },
      {
        "zakres_dlugosci": "30+",
        "wartosc": 30
      }
    ],
    "odczyty_jakosc_mediana": 30,
    "odczyty_jakosc_histogram": [
      {
        "zakres_jakosci": "10-20",
        "wartosc": 30
      },
      {
        "zakres_jakosci": "20-30",
        "wartosc": 30
      },
      {
        "zakres_jakosci": "30+",
        "wartosc": 30
      }
    ]
  },
  {
    "plik_nazwa": "ala2.fastq.gz",
    "status": "Tak",
    "etap": "oryginalne",
    "odczyty_calkowita_liczba": 10020,
    "odczyty_calkowita_liczba_zasad": 100200,
    "odczyty_dlugosc_mediana": 1250,
    "odczyty_dlugosc_histogram": [
      {
        "zakres_dlugosci": "10-20",
        "wartosc": 30
      },
      {
        "zakres_dlugosci": "20-30",
        "wartosc": 30
      },
      {
        "zakres_dlugosci": "30+",
        "wartosc": 30
      }
    ],
    "odczyty_jakosc_mediana": 30,
    "odczyty_jakosc_histogram": [
      {
        "zakres_jakosci": "10-20",
        "wartosc": 30
      },
      {
        "zakres_jakosci": "20-30",
        "wartosc": 30
      },
      {
        "zakres_jakosci": "30+",
        "wartosc": 30
      }
    ]
  },
  {
    "plik_nazwa": "forward.fastq",
    "status": "Blad",
    "etap": "post-filtering",
    "komunikat_bledu": ""
  }
]
